{"id":"case-026","description":"pd.DataFrame.reset_index (grounded) — AI resets index after groupby","code":"import pandas as pd\ndf = pd.DataFrame({'a': [1, 2, 3]}, index=[10, 20, 30])\nresult = pd.DataFrame.reset_index(df)\n","expected":{"verdict":"grounded","claim_contains":"reset_index"},"category":"valid-api"}
