{"id":"case-020","description":"pd.DataFrame.groupby (grounded) — AI groups and aggregates","code":"import pandas as pd\ndf = pd.DataFrame({'category': ['a', 'b', 'a'], 'value': [10, 20, 30]})\nresult = pd.DataFrame.groupby(df, 'category')\n","expected":{"verdict":"grounded","claim_contains":"groupby"},"category":"valid-api"}
