{"id":"case-016","description":"pd.DataFrame.tshift removed in pandas 2.0 — AI shifts time-indexed data","code":"import pandas as pd\nimport numpy as np\nidx = pd.date_range('2020-01-01', periods=5, freq='D')\ndf = pd.DataFrame({'value': np.arange(5)}, index=idx)\nshifted = pd.DataFrame.tshift(df, 2)\n","expected":{"verdict":"contradicted","claim_contains":"tshift"},"category":"removed-api"}
