{"id":"case-047","description":"import lightgbm (unverifiable) — not installed, ImportError trap","code":"import lightgbm as lgb\ndataset = lgb.Dataset(X_train, label=y_train)\nparams = {'objective': 'binary', 'num_leaves': 31}\nmodel = lgb.train(params, dataset, num_boost_round=100)\n","expected":{"verdict":"unverifiable","claim_contains":"lightgbm"},"category":"import-error-trap"}
