{"id":"case-022","description":"pd.DataFrame.fillna (grounded) — AI fills missing values","code":"import pandas as pd\ndf = pd.DataFrame({'a': [1.0, None, 3.0], 'b': [None, 2.0, None]})\nresult = pd.DataFrame.fillna(df, 0)\n","expected":{"verdict":"grounded","claim_contains":"fillna"},"category":"valid-api"}
